{
  "schemaVersion": 1,
  "bar": {
    "enabled": true,
    "edge": "bottom",
    "exclusive": true,
    "height": 26,
    "trayHostEnabled": true,
    "moduleSpacing": 8,
    "aiQuotaEnabled": true,
    "brightnessEnabled": true,
    "bluetoothEnabled": true,
    "idleInhibitorEnabled": true,
    "metrics": {
      "cpu": true,
      "memory": true,
      "disk": true,
      "temperature": true,
      "order": ["disk", "memory", "cpu", "temperature"]
    }
  },
  "clock": {
    "showSeconds": false,
    "format24h": false
  },
  "notifications": {
    "enabled": true,
    "popupEnabled": true,
    "historyEnabled": true,
    "historyLimit": 100,
    "maxSummaryBytes": 512,
    "maxBodyBytes": 8192,
    "maxActions": 8
  },
  "osd": {
    "enabled": true,
    "durationMs": 2000,
    "maxQueue": 8
  },
  "commands": {
    "timeoutMs": 5000,
    "termGraceMs": 1000,
    "maxOutputBytes": 32768
  },
  "appearance": {
    "fontFamily": "Inter",
    "monospaceFontFamily": "JetBrainsMono Nerd Font",
    "iconFontFamily": "Material Symbols Rounded",
    "fontSize": 14,
    "spacing": 8,
    "radius": 10,
    "borderWidth": 1,
    "opacity": 1,
    "shadows": true,
    "animations": true
  }
}
